{
  "$schema": "https://json-schema.org/draft/2020-12/schema",
  "$id": "https://mulgae.local/schemas/mulgae-provider-review-wire.v3.schema.json",
  "title": "Mulgae Provider Review Wire v3",
  "description": "Provider-owned root-review wire projection. Mulgae injects current target identity and verification before validating the normalized v3 envelope.",
  "type": "object",
  "additionalProperties": false,
  "required": [
    "schema_version",
    "summary",
    "completeness",
    "limitations",
    "findings"
  ],
  "properties": {
    "schema_version": {
      "const": "mulgae-provider-review-output.v3"
    },
    "summary": {
      "type": "string",
      "minLength": 1,
      "maxLength": 4000
    },
    "completeness": {
      "type": "string",
      "enum": [
        "complete",
        "incomplete"
      ]
    },
    "limitations": {
      "type": "array",
      "maxItems": 20,
      "uniqueItems": true,
      "items": {
        "type": "string",
        "minLength": 1,
        "maxLength": 2000
      }
    },
    "findings": {
      "type": "array",
      "maxItems": 200,
      "items": {
        "$ref": "#/$defs/finding"
      }
    }
  },
  "$defs": {
    "path": {
      "type": "string",
      "minLength": 1,
      "maxLength": 4096,
      "pattern": "^(?!/)(?!.*//)(?!.*\\/$)(?!.*(?:^|/)\\.{1,2}(?:/|$))(?!.*[\\\\\u0000\\r\\n]).+$"
    },
    "current": {
      "description": "Provider location claim. Mulgae injects target_sha256 and verification=claimed; the provider must not supply either field.",
      "type": "object",
      "additionalProperties": false,
      "required": [
        "path",
        "line_start",
        "line_end",
        "side",
        "quote"
      ],
      "properties": {
        "path": {
          "$ref": "#/$defs/path"
        },
        "line_start": {
          "type": "integer",
          "minimum": 1
        },
        "line_end": {
          "type": "integer",
          "minimum": 1
        },
        "side": {
          "type": "string",
          "enum": [
            "base",
            "head",
            "worktree",
            "index"
          ]
        },
        "quote": {
          "type": "string",
          "minLength": 1
        }
      }
    },
    "bbox": {
      "type": "object",
      "additionalProperties": false,
      "required": ["x", "y", "width", "height"],
      "properties": {
        "x": {"type": "integer", "minimum": 0},
        "y": {"type": "integer", "minimum": 0},
        "width": {"type": "integer", "minimum": 1},
        "height": {"type": "integer", "minimum": 1}
      }
    },
    "visual": {
      "description": "Provider claim against one captured design-spec raster.",
      "type": "object",
      "additionalProperties": false,
      "required": ["path", "sha256", "bbox"],
      "properties": {
        "path": {"$ref": "#/$defs/path"},
        "sha256": {"type": "string", "pattern": "^sha256:[0-9a-f]{64}$"},
        "bbox": {"$ref": "#/$defs/bbox"}
      }
    },
    "evidence": {
      "type": "object",
      "additionalProperties": false,
      "required": [
        "current"
      ],
      "properties": {
        "current": {
          "$ref": "#/$defs/current"
        },
        "visual": {
          "$ref": "#/$defs/visual"
        }
      }
    },
    "finding": {
      "type": "object",
      "additionalProperties": false,
      "required": [
        "severity",
        "title",
        "description",
        "evidence",
        "recommendation",
        "confidence"
      ],
      "properties": {
        "severity": {
          "type": "string",
          "enum": [
            "info",
            "low",
            "medium",
            "high",
            "critical",
            "blocker"
          ]
        },
        "title": {
          "type": "string",
          "minLength": 1,
          "maxLength": 300
        },
        "description": {
          "type": "string",
          "minLength": 1,
          "maxLength": 12000
        },
        "evidence": {
          "type": "array",
          "minItems": 1,
          "maxItems": 20,
          "items": {
            "$ref": "#/$defs/evidence"
          }
        },
        "recommendation": {
          "type": "string",
          "minLength": 1,
          "maxLength": 12000
        },
        "confidence": {
          "type": "string",
          "enum": [
            "low",
            "medium",
            "high"
          ]
        }
      }
    }
  }
}
